id;subject_rf;name_full;name_short;name_employee;inn;orn;legal_address;actual_address;phone;email;site;count_mkd;area_total;w_summ
8432252;"Новосибирская область";"ТОВАРИЩЕСТВО СОБСТВЕННИКОВ ЖИЛЬЯ ""ОХРАНА""";"ТСЖ ""ОХРАНА""";"Наталья Федоровна Просол";5407012094;1065407005135;"г. Новосибирск, ул. Железнодорожная, д. 6/2";"г. Новосибирск, ул. Железнодорожная, д. 6/2";2219996;tszh.oxrana@yandex.ru;;1;8436,00;34,00
8483431;"Новосибирская область";"Товарищество собственников жилья Очаг";"ТСЖ Очаг";"Марина Дмитриевна Мартынова";5404145040;1025401485130;"г. Новосибирск, ул. Новосибирская, д. 14";"г. Новосибирск, ул. Новосибирская, д. 14";3418347,3101235;m.d._martinova@mail.ru;;1;4781,50;28,50
8913887;"Новосибирская область";"ТСЖ ""Первомайская 9""";"ТСЖ ""П-9""";"Ирина Александровна Махновец";5438320042;1145476039500;"рп. Горный, ул. Первомайская, д. 9";"рп. Горный, ул. Первомайская, д. 9";8-923-127-6664;makhnovets74@mail.ru;;1;5045,00;30,00
8917268;"Новосибирская область";"Товарищество собственников Жилья ""Памир""";"ТСЖ ""Памир""";"Любовь Дмитриевна Ополева";5403205218;1085403002728;"г. Новосибирск, ул. Зорге, д. 243";"г. Новосибирск, ул. Зорге, д. 243";215-48-50;irinaserb@bk.ru;;1;5937,70;32,50
8927280;"Новосибирская область";"Товарищество собственников жилья  ""Панфиловцев5""";"ТСЖ ""Панфиловцев5""";"Богдан Антонович Грынык";5405412442;1105405009137;"г. Новосибирск, ул. Панфиловцев, д. 5";"г. Новосибирск, ул. Панфиловцев, д. 5";89061942265;panfilovcev5@mail.ru;;1;13505,00;32,50
8601878;"Новосибирская область";"Товарищество собственников жилья ""Паркхаус""";"ТСЖ ""Паркхаус""";"Евгений Михайлович Трофимов ";5407255562;1035403209203;"г. Новосибирск, ул. Урицкого, д. 20, п. 280";"г. Новосибирск, ул. Урицкого, д. 20, п. 280";8-923-158-1962;parkhaus@bk.ru;;1;9875,20;28,50
8927059;"Новосибирская область";"Товарищество собственников жилья ""Пашино-175""";ТСЖ-Пашино-175;"Владимир Алексеевич Постников";5410041754;1115476062570;"г. Новосибирск, ул. Новоуральская, д. 17/5, п. 16";"г. Новосибирск, д. 17/5, п. 16";"(383) 274 60 02";tcg-175@ngs.ru;reformagkh.ru;1;2646,50;33,00
8588839;"Новосибирская область";"Товарищество собственников жилья ""Первый Горский""";"ТСЖ Первый Горский";"Владимир Викторович Брюханов";5404303031;1065400045370;"г. Новосибирск, мкр. Горский, д. 1";"г. Новосибирск, мкр. Горский, д. 1";8(383)361-31-53;tsg-1gorsky@yandex.ru;;1;27128,00;30,00
8916519;"Новосибирская область";"Товарищество собственников жилья ""Перлит""";"ТСЖ ""Перлит""";"Юрий Николаевич Сыщенко";5407468955;1115476113830;"г. Новосибирск, ул. Салтыкова-Щедрина, д. 128";"г. Новосибирск, ул. Салтыкова-Щедрина, д. 128";+79231988257;perlit-tsg@mail.ru;;1;10589,60;36,50
8925383;"Новосибирская область";"Товарищество собственников жилья ""Петухова 130/1""";"ТСЖ «Петухова 130/1»";"Тамара Степанова Суханова";5403354812;1145476003122;"г. Новосибирск, ул. Петухова, д. 130/1";"г. Новосибирск, ул. Петухова, д. 130/1";"+7 953 880-15-69";130-1-145@mail.ru;http://тсж.жкхнсо.рф/тсж-петухова1301/;1;13285,60;34,50
8923438;"Новосибирская область";"Товарищество собственников жилья ""Петухова 134, 136""";"ТСЖ ""Петухова 134, 136""";"Татьяна Викторовна Журавлева";5403229716;1095403007391;"г. Новосибирск, ул. Петухова, д. 134";"г. Новосибирск, ул. Петухова, д. 134";+79529370964;zhuravleva.6702@list.ru;;2;7545,50;32,50
8929262;"Новосибирская область";"Товарищество собственников жилья ""Петухова, 22/1""";"ТСЖ ""Петухова, 22/1""";"Андрей Евгеньевич Маслов ";5403234868;1095403012760;"г. Новосибирск, ул. Петухова, д. 22/1";"г. Новосибирск, ул. Петухова, д. 22/1";8-906-193-33-33;tsg_petyhova@ngs.ru;tsg_petyhova@ngs.ru;1;8741,40;26,50
8933142;"Новосибирская область";"Товарищество собственников жилья ""Петухова,76""";"ТСЖ ""Петухова,76""";"Наталья Александровна Петроченко";5403231289;1095403009030;"г. Новосибирск, ул. Петухова, д. 76";"г. Новосибирск, ул. Петухова, д. 76";"+7 (913) 720-18-71";melyke@mail.ru;;1;13911,30;33,50
8928253;"Новосибирская область";"ТОВАРИЩЕСТВО СОБСТВЕННИКОВ ЖИЛЬЯ ""Печатников,10""";"ТСЖ ""Печатников,10""";"Людмила Николаевна Усольцева";5408306403;1145476004134;"г. Новосибирск, ул. Печатников, д. 10";"г. Новосибирск, ул. Печатников, д. 10";89132004917;piren08@mail.ru;;1;2668,30;32,00
8559588;"Новосибирская область";"Товарищество собственников Жилья ""ПИКЕТ""";"ТСЖ ""ПИКЕТ""";"Гельфирус Идеатулловна Бельхеева";5401268011;1065401092008;"г. Новосибирск, ул. Толбухина, д. 35/1";"г. Новосибирск, ул. Толбухина, д. 35/1, стр. МКД";"261 47 32  89139272777";tsgpiket@yandex.ru;0;1;3589,00;35,50
8568698;"Новосибирская область";"Товарищество собственников жилья ""Пирогова, 26""";"ТСЖ ""Пирогова, 26""";"Анна Сергеевна Сызранова";5408230401;1045404696590;"г. Новосибирск, ул. Пирогова, д. 26";"г. Новосибирск, ул. Пирогова, д. 26";8-913-019-62-02;pirog26@bk.ru;www.tsj.ru/pirogova26;1;11838,50;66,50
8503765;"Новосибирская область";"Товарищество собственников жилья « Плахотного»";"ТСЖ ""Плахотного";"Галина Юрьевна Французова";5404238696;1045401530910;"г. Новосибирск, ул. Плахотного, д. 74/1";"г. Новосибирск, ул. Плахотного, д. 74/1";"8 983 130 84 56";plahotnogo@yandex.ru;;1;6327,00;32,00
8457526;"Новосибирская область";"Товарищество собственников жилья «Плехановец»";"ТСЖ «Плехановец»";"Борис Григорьевич Богданов";5410047379;1125476071929;"г. Новосибирск, ул. Кропоткина, д. 130";"г. Новосибирск, ул. Кропоткина, д. 130";8-913-910-73-61;tsg.plehanovec@yandex.ru;http://тсж.жкхнсо.рф/тсж-плехановец/;1;;16,50
8930790;"Новосибирская область";"Товарищество собственников жилья ""Победа""";"ТСЖ ""Победа""";"Татьяна Геннадьевна Гладырь";5403327294;1115476031285;"г. Новосибирск, ул. Оловозаводская, д. 18/1";"г. Новосибирск, д. 18/1";89133835081;tgladyr@bk.ru;tszh-pobeda.ucoz.ru;1;4318,50;31,50
8933794;"Новосибирская область";"ТОВАРИЩЕСТВО СОБСТВЕННИКОВ ЖИЛЬЯ ""ПОБЕДА""";"ТСЖ ""ПОБЕДА""";"МИХАИЛ МИХАЛОЙВИЧ ИВАНОЧКО";5407951640;1165476057075;"г. Новосибирск, ул. Ленина, д. 9";"г. Новосибирск, ул. Ленина, д. 9";8(383)2235411;pobeda9tsg@mail.ru;www.pobeda9tsg.com;1;6653,60;30,00
8917397;"Новосибирская область";"Товарищество собственников жилья «Подгорный»";"ТСЖ «Подгорный»";"Галина Петровна Крюкова";5446105105;1025404791444;"г. Искитим, мкр. Подгорный, д. 5";"г. Искитим, мкр. Подгорный, д. 5";"8 (38343) 2-75-34  8-913-740-26-76 (председатель правления)";tsgisk@mail.ru;tsg-podgornij-iskitim.ru;1;5290,40;28,50
8916988;"Новосибирская область";"Товарищество Собственников Жилья ""Подгорный-4""";"ТСЖ ""Подгорный-4""";"Станислав Иванович Попов";5446105137;1025404790872;"г. Искитим, мкр. Подгорный, д. 26";"г. Искитим, мкр. Подгорный, д. 26";+7(38343)2-82-19;staspopov2@gmail.com;http://подгорный-4.рф/;1;5936,20;26,50
8918923;"Новосибирская область";"Товарищество собственников жилья ""Подгорный-5""";"ТСЖ ""Подгорный-5""";"Инна Леонидовна Кашникова";5446105144;1025404792049;"г. Искитим, мкр. Подгорный, д. 34";"г. Искитим, мкр. Подгорный, д. 34";89529314739;trocenkoinna@mail.ru;www.reformagkh.ru;1;5186,50;22,50
8918474;"Новосибирская область";"Товарищество собственников жилья  ""Подгорный-7""";"ТСЖ ""Подгорный-7""";"Зинаида Кузьминична Мусатова";5446009850;1085472002648;"г. Искитим, мкр. Подгорный, д. 7";"г. Искитим, мкр. Подгорный, д. 7";+79059371702;musatovaz@mail.ru;;1;5521,00;27,50
8877707;"Новосибирская область";"Товарищество собственников жилья ""Позитрон""";"ТСЖ ""Позитрон""";"Любовь Григорьевна Степанова";5401317685;1085401022662;"г. Новосибирск, ул. Селезнева, д. 24";"г. Новосибирск, ул. Селезнева, д. 24";9137118801;pozitron_24@mail.ru;;1;8821,00;28,50
8926287;"Новосибирская область";"Товарищество Собственников Жилья ""ПОЛЮС""";"ТСЖ ""Полюс""";"Вячеслав Анатольевич Яуфман";5403209491;1085403007359;"г. Новосибирск, ул. Зорге, д. 121";"г. Новосибирск, ул. Зорге, д. 121";89537690204;3420358@mail.ru;www.reformagkh.ru;1;4964,00;29,50
8933863;"Новосибирская область";"Товарищество собственников жилья ""Правобережье""";"ТСЖ ""Правобережье""";"Марина Юрьевна Каблукова";5405322301;1065405124025;"г. Новосибирск, ул. Большевистская, д. 177";"г. Новосибирск, ул. Нижегородская, д. 24, п. 57";9139066174;tsg2006@mail.ru;http://731.degkh.ru/tszh_pravoberezhe/;2;13300,30;33,50
8707222;"Новосибирская область";"Товарищество собственников жилья ""Премьер""";"ТСЖ ""Премьер""";"Елена Витальевна Зиминова";5422110917;1045480000037;"г. Карасук, ул. Союзная, д. 31, п. 59";"г. Карасук, ул. Союзная, д. 31, п. 59";"8 913 938 85 15";ziminova.lena@yandex.ru;;1;4108,52;31,50
8574644;"Новосибирская область";"Товарищество собственников жилья ""Прибой""";"ТСЖ ""Прибой""";"Олеся Владиславовна Швиндт";5408288560;1115476077474;"г. Новосибирск, ул. Ивлева, д. 164";"г. Новосибирск, ул. Ивлева, д. 164";8-913-900-40-85;tszh.priboy@mail.ru;;1;3946,00;36,50
8603822;"Новосибирская область";"Товарищество Собственников Жилья ""Прибрежный""";"ТСЖ ""Прибрежный""";"Наталья Сергеевна Мирошниченко";5445264198;1105445002167;"г. Бердск, ул. Попова, д. 11/2";"г. Бердск, ул. Попова, д. 11/2";"8(383)41-6-01-27, 8-913-767-7713. Служба контроля - 8-951-363-4753";tsgberdsk@yandex.ru;iberdsk.ru/jkh/tszh-pribrezhnoe/;1;18308,00;30,50
8926417;"Новосибирская область";"ТОВАРИЩЕСТВО СОБСТВЕННИКОВ ЖИЛЬЯ ""ПРИБРЕЖНЫЙ""";"ТСЖ ""ПРИБРЕЖНЫЙ""";"Дмитрий Александрович Архипов";5404508504;1145476042645;"г. Новосибирск, ул. Портовая, д. 2";"г. Новосибирск, ул. Портовая, д. 2";8-952-900-90-50;tsj.pribrejniy@yandex.ru;http://731.degkh.ru/tszh_pribrezhnyy/;1;2519,60;29,00
8484322;"Новосибирская область";"Товарищество собственников жилья ""Прима""";"ТСЖ ""Прима""";"Екатерина Андреевна Белоног";5404305198;1075400000235;"г. Новосибирск, пер. Римского-Корсакова 1-й, д. 5";"г. Новосибирск, пер. Римского-Корсакова 1-й, д. 5";8-952-943-08-82;tsgprima@mail.ru;;1;16891,00;33,00
8623937;"Новосибирская область";"Товарищество собственников жилья ""ПРИМОРСКИЙ-1""";"ТСЖ ""ПРИМОРСКИЙ-1""";"Владимир Георгиевич Кусов";5408154528;1025403667024;"г. Новосибирск, ул. Приморская, д. 26";"г. Новосибирск, ул. Приморская, д. 26";89134550229;tsgprim1@ngs.ru;;1;10264,20;
8915431;"Новосибирская область";"Товарищество собственников жилья  ""Прогресс""";"ТСЖ ""Прогресс""";"Борис Тимофеевич Якутин";5406159672;1045402547761;"г. Новосибирск, ул. Серебренниковская, д. 4\1";"г. Новосибирск, ул. Серебренниковская, д. 4\1";89139475539;serebroprogress@mail.ru;;1;5501,00;35,50
8928138;"Новосибирская область";"Товарищество собственников жилья Прогресс";"ТСЖ Прогресс";"Тамара Николаевна Логинова";5438318759;1105461000116;"рп. Горный, ул. Советская, д. 22";"рп. Горный, ул. Советская, д. 22";89513769270;Lydmila090480@yandex.ru;http://gorniy.wix.com/progress;1;5607,00;28,50
8595446;"Новосибирская область";"Товарищество собственников жилья ""Прогресс 2""";"ТСЖ ""Прогресс 2""";"Сергей Владимирович Прутский";5406205103;1025402477077;"г. Новосибирск, ул. Серебренниковская, д. 4/1, п. 5 и 6 блок секция";"г. Новосибирск, ул. Серебренниковская, д. 4/1, п. 5 и 6 блок-секция";89039352351;klyakinal@rambler.ru;"www.reformagkh.ru, http://731.degkh.ru/tszh_progress_2/";1;8559,90;34,50
8578439;"Новосибирская область";"Товарищество собственников жилья ""Прсопект""";"ТСЖ ""Проспект""";"Раиса Петровна Жеребятникова";5402503821;1085402020208;"г. Новосибирск, пр-кт. Красный, д. 23/2";"г. Новосибирск, пр-кт. Красный, д. 23/2";(383)200-11-68;prospekt232@mail.ru;http://tsg54.ru/prospect/;1;10290,10;36,50
8599718;"Новосибирская область";"Товарищество собственников жилья ""Простор""";"ТСЖ ""Простор""";"Людмила Юрьевна Кононенко";5404379792;1085404034210;"г. Новосибирск, ул. Широкая, д. 21\1";"г. Новосибирск, ул. Широкая, д. 21\1";+73833522689;prostor21.1@ngs.ru;;1;2619,40;26,00
8583099;"Новосибирская область";"Товарищество собственников жилья Пульсар";"ТСЖ Пульсар";"Дмитрий Эдуардович Закревский ";5408184071;1025403642186;"г. Новосибирск, ул. Терешковой, д. 31";"г. Новосибирск, ул. Терешковой, д. 31";8(383)335682;semke_m@mail.ru;;1;2868,20;25,00
8507428;"Новосибирская область";"Товарищество собственников жилья Радуга";"ТСЖ  Радуга";"Денис Владимирович Дорохов";5432211375;1045405227890;"п. Радуга, ул. Ключевская, д. 16";"п. Радуга, ул. Ключевская, д. 16";83834855-180;rc9@mail.ru;;10;12623,20;31,50
8929144;"Новосибирская область";"Товарищество собственников жилья ""Радуга""";"ТСЖ ""Радуга""";"Евгения Валентиновна Диревская";5404413411;1105476009650;"г. Новосибирск, ул. Костычева, д. 16/1";"г. Новосибирск, ул. Костычева, д. 16/1";+79529013274;evgeniya.direvskaya@mail.ru;;1;6413,10;34,50
8599629;"Новосибирская область";"Товарищество собственников жилья ""Радуга""";"ТСЖ ""Радуга""";"Тамара Павловна Чепик";5445258290;1085445004050;"г. Бердск, ул. Микрорайон, д. 70";"г. Бердск, ул. Микрорайон, д. 70";8-923-231-49-56;raduga70@ngs.ru;https://www.reformagkh.ru/;1;6923,70;50,50
8614365;"Новосибирская область";"Товарищество собственников жилья РАДУГА";"ТСЖ ""РАДУГА""";"Иван Владимирович Башкеев";5406268713;1035402518689;"г. Новосибирск, ул. Серебренниковская, д. 4\1";"г. Новосибирск, ул. Серебренниковская, д. 4\1";89139475539;radugaserebro@mail.ru;;1;4796,30;34,50
7617679;"Новосибирская область";"Товарищество собственников жилья ""Радужный""";"ТСЖ ""Радужный""";"Виталий Александрович Андреев";5404360640;1085404013463;"г. Новосибирск, ул. Блюхера, д. 1";"г. Новосибирск, ул. Блюхера, д. 1";"+7 913 956 8236";tszh.raduzhnyj@gmail.com;http://731.degkh.ru/tszh_raduzhnyy/;1;3440,50;32,50
8164480;"Новосибирская область";"Товарищество собственников жилья ""Радужный""";"ТСЖ ""Радужный""";"Светлана Викторовна Бахметова";5402530279;1105476060469;"г. Новосибирск, ул. Галущака, д. 9";"г. Новосибирск, ул. Галущака, д. 9";"(383) 240-34-35";raduga900@gmail.com;http://raduga9.nsknet.ru/;1;8558,30;31,50
8916799;"Новосибирская область";"Товарищество собственников жилья ""Радужный каскад""";"ТСЖ ""Радужный каскад""";"Наталья Фёдоровна Торопова";5404393821;1095404013946;"г. Новосибирск, ул. Горская, д. 2, п. 125";"г. Новосибирск, ул. Горская, д. 2, п. 125";8-383-335-61-48;r-kackad@list.ru;www.r-kackad.ru;1;11255,20;32,50
8179636;"Новосибирская область";"Товарищество собственников жилья ""Разъездная 10""";"ТСЖ ""Разъездная 10""";"Николай Николаевич Чиканов";5408267722;1085473018025;"г. Новосибирск, ул. Разъездная, д. 10";"г. Новосибирск, ул. Разъездная, д. 10";328-31-93;raz10@ngs.ru;raz10.ru;1;12418,20;33,50
8935212;"Новосибирская область";"Товарищество собственников жилья ""Рапсодия""";"ТСЖ  ""Рапсодия""";"Владимир Петрович Кочетов";5405334635;1065400045490;"г. Новосибирск, ул. Бориса Богаткова, д. 179";"г. Новосибирск, ул. Бориса Богаткова, д. 179";383-2-139-701;vlp5@narod.ru;;1;7443,20;28,50
8664618;"Новосибирская область";"Товарищество собственников жилья ""Рассвет""";"ТСЖ ""Рассвет""";"Светлана Борисовна Михеева";5401348429;1115476079707;"г. Новосибирск, ул. Кошурникова, д. 31";"г. Новосибирск, ул. Кошурникова, д. 31";7-953-762-16-69;tsg.rassvet@ngs.ru;https://www.reformagkh.ru;1;4298,00;
8925946;"Новосибирская область";"Товарищество собственников жилья Рассвет";"ТСЖ Рассвет";"Василий Николаевич Контарев";5438316085;1055461023672;"рп. Горный, ул. Советская, д. 25";"рп. Горный, ул. Советская, д. 25";"8(913) 391-57-22";www.tcpassvet@mail.ru;www.reformagkh.ru;1;3646,00;31,50
8595827;"Новосибирская область";"Товарищество собственников жилья ""Революции-10""";"ТСЖ ""Революции-10""";"Валерий Владимирович Войков";5407032848;1075400003250;"г. Новосибирск, ул. Революции, д. 10, п. 20";"г. Новосибирск, ул. Революции, д. 10, п. 20";+79537993994;tsg.r-10@yandex.ru;tsg-10.org.ru;1;10145,60;31,50
8439139;"Новосибирская область";"Товарищество собственников жилья ""Революции 6""";"ТСЖ ""Революции 6""";"Александр Иванович Луппов";5407194373;1025403205640;"г. Новосибирск, ул. Революции, д. 6";"г. Новосибирск, ул. Революции, д. 6";+79039999102;tsg.rev6@gmail.com;http://731.degkh.ru/tszh_revolyutsii_6/;1;36490,00;
8033184;"Новосибирская область";"ТСЖ ""Революции,7""";"ТСЖ ""Революции,7""";"Юрий Владимирович Добросердов";5407032781;1075400003140;"г. Новосибирск, ул. Революции, д. 7";"г. Новосибирск, ул. Революции, д. 7";8-953-780-2190;3802190@mail.ru;http://www.731.degkh.ru/;1;15871,00;33,50
8915677;"Новосибирская область";"Товарищество собственников жилья ""Ритм""";"ТСЖ ""Ритм""";"Татьяна Ивановна Королева";5404328766;1075400003139;"г. Новосибирск, ул. Римского-Корсакова, д. 4б";"г. Новосибирск, ул. Римского-Корсакова, д. 4б";8-913-918-01-21;sekirolya@mail.ru;http://731.degkh.ru/tszh_ritm/;1;3663,30;31,50
8922312;"Новосибирская область";"товарищество собственников жилья ТСЖ ""РК 21""";"ТСЖ ""РК 21""";"Юрий Викторович Карпачёв";5403320316;1105476027557;"г. Новосибирск, ул. Римского-Корсакова, д. 21";"г. Новосибирск, ул. Римского-Корсакова, д. 21";8-913-204-10-33;novbumtorg@list.ru;reformagkh.ru;1;8998,80;28,50
8897630;"Новосибирская область";"Товарищество собственников жилья ""Родина""";"ТСЖ ""Родина""";"Ольга Ивановна Ушатова";5401267480;1065401091491;"г. Новосибирск, ул. Дениса Давыдова, д. 5";"г. Новосибирск, ул. Дениса Давыдова, д. 5";"+7 905 952 8986";TSJRodina@yandex.ru;http://731.degkh.ru/tszh_rodina/;1;15184,80;35,50
8912412;"Новосибирская область";"Товарищество собственников жилья ""Родина""";"ТСЖ ""Родина""";"Наталья Николаевна Сковпень";5445118937;1055445002700;"г. Бердск, ул. Микрорайон, д. 48А, п. 80";"г. Бердск, ул. Микрорайон, д. 48А";89139869712;n.n.skovpen@yandex.ru;https://www.reformagkh.ru;1;8219,10;32,50
8917167;"Новосибирская область";"Товарищество собстенников жилья ""Родник""";"ТСЖ ""Родник""";"Нина Васильевна Сухорукова";5446008768;1085472000382;"г. Искитим, ул. Нагорная, д. 9";"г. Искитим, ул. Нагорная, д. 9";(38343)26485;3.2008.rodnik@mail.ru;;1;4200,00;21,00
