id;subject_rf;name_full;name_short;name_employee;inn;orn;legal_address;actual_address;phone;email;site;count_mkd;area_total;w_summ
8107013;"Новосибирская область";"Товарищество собственников жилья ""Дениса Давыдова 1""";"ТСЖ ""Дениса Давыдова 1""";"Маргарита Михайловна Тараторина";5401285426;1075400001896;"г. Новосибирск, ул. Дениса Давыдова, д. 1";"г. Новосибирск, ул. Дениса Давыдова, д. 1";+7(383)2654311;davydovadom1@mail.ru;731.degkh.ru/tszh_denisa_davydova_1/;1;19093,00;33,00
7556607;"Новосибирская область";"Товарищество собственников жилья «Дениса Давыдова 7/1»";"ТСЖ «Дениса Давыдова 7/1»";"Наталья Леонардовна Лукина";5401320455;1095401000045;"г. Новосибирск, ул. Дениса Давыдова, д. 7/1, п. 89";"г. Новосибирск, ул. Дениса Давыдова, д. 7/1, п. 89";265-63-47;tsg7-1@mail.ru;http://тсж.жкхнсо.рф/тсж-ддавыдова71/;1;10088,40;33,00
8440920;"Новосибирская область";"Товарищество собственников жилья ""Депутатская-2""";"ТСЖ ""Депутатская-2""";"Дмитрий Борисович Рябышев";5407183452;1025403222008;"г. Новосибирск, ул. Депутатская, д. 2";"г. Новосибирск, ул. Депутатская, д. 2";"(383) 218-10-55";deputat2@ngs.ru;;1;25864,00;28,50
8917673;"Новосибирская область";"Товарищество собственников жилья ""Державина-14""";"ТСЖ ""Державина-14""";"Тамара Михайловна Карпенко";5406381356;1075400000103;"г. Новосибирск, ул. Державина, д. 14";"г. Новосибирск, ул. Державина, д. 14";"+7 383 2219581";dom@derzhavina-14.ru;derzhavina-14.ru;1;6558,20;28,00
8913469;"Новосибирская область";"Товарищество Собственников Жилья «Державина,6»";"ТСЖ «Державина,6»";"Ольга Анатольевна Мачавариани";5406657406;1115476007316;"г. Новосибирск, пр-кт. Красный, д. 51/5, п. 10";"г. Новосибирск, пр-кт. Красный, д. 51/5, п. 10";8-913-774-8420;derzhavina6@mail.ru;http://www.reformagkh.ru/mymanager/organization/8913469;1;2293,60;33,00
8884273;"Новосибирская область";"Товарищество собственников жилья ""Дзержинец""";"ТСЖ""Дзержинец""";"Андрей Анатольевич Санатосенко";5401222225;1045400507844;"г. Новосибирск, пр-кт. Дзержинского, д. 14/3";"г. Новосибирск, пр-кт. Дзержинского, д. 14/3";89139126944;aero4571@mail.ru;;1;4013,80;25,00
8928018;"Новосибирская область";"Товарищество собственников ""Дизелист""";"ТСЖ ДИЗЕЛИСТ";"Андрей Викторович Боровко";5404411206;1105476003577;"г. Новосибирск, ул. Немировича-Данченко, д. 30/2";"г. Новосибирск, ул. Немировича-Данченко, д. 30/2";89134841432;tsgdizelist@mail.ru;;1;2244,70;24,50
8487582;"Новосибирская область";"Товарищество собственников жилья ""Динамовец""";"ТСЖ ""Динамовец""";"Наталья Анатольевна Полунина";5408274984;1095473009037;"г. Новосибирск, ул. Динамовцев, д. 15";"г. Новосибирск, ул. Динамовцев, д. 15";8-913-934-24-02;dinamovec54@ngs.ru;http://d15nsk.zbord.ru/;2;29422,70;34,00
8923429;"Новосибирская область";"Товарищество собственников жилья ""Динамовцев 14""";"ТСЖ ""Динамовцев 14""";"Валентина Анатольевна Борзова";5408308697;1145476064282;"г. Новосибирск, ул. Динамовцев, д. 14";"г. Новосибирск, ул. Динамовцев, д. 14";8-913-902-92-39;dinamovcev14.2016@mail.ru;0;1;7897,00;43,50
8410313;"Новосибирская область";"Товарищество собственников жилья «Д.Ковальчук 258»";"ТСЖ «Д.Ковальчук 258»";"Елена Михайловна Мисюк";5402524564;1105402003233;"г. Новосибирск, ул. Дуси Ковальчук, д. 258";"г. Новосибирск, ул. Дуси Ковальчук, д. 258";"+7 (383) 203-28-11";dk258@yandex.ru;http://тсж.жкхнсо.рф/тсж-дковальчук258/;1;34873,30;
8915681;"Новосибирская область";"Товарищество собственников жилья ""Д.Ковальчук-414""";"ТСЖ ""Д.Ковальчук-414""";"Анатолий Афанасьевич Пушкин";5402519853;1095402013750;"г. Новосибирск, ул. Дуси Ковальчук, д. 414";"г. Новосибирск, ул. Дуси Ковальчук, д. 414";"8(383) 2282576";2282576@gmail.com;;1;7341,00;28,50
8573841;"Новосибирская область";"Товарищество собственников жилья ""Доватора 15""";"ТСЖ ""Доватора 15""";"Татьяна Фёдоровна Згурина";5401350763;1115476111981;"г. Новосибирск, ул. Доватора, д. 15";"г. Новосибирск, ул. Доватора, д. 15";+7-913-06-04-134;zgurina.tatyana@ngs.ru;http://тсж.жкхнсо.рф/тсж-доватора15/;1;3575,50;33,00
8553599;"Новосибирская область";"Товарищество собственников жилья «Доватора-19»";"ТСЖ «Доватора-19»";"Владимир Васильевич Федосов";5401324650;1095401004170;"г. Новосибирск, ул. Доватора, д. 19";"г. Новосибирск, ул. Доватора, д. 19";+7-913-944-7735;vovk58@list.ru;http://тсж.жкхнсо.рф/тсж-доватора19/;1;5023,70;35,50
8081793;"Новосибирская область";"Товарищество собственников жилья «Долина»";"ТСЖ «Долина»";"Александр Васильевич Ятченко";5408232705;1055473043823;"г. Новосибирск, ул. Золотодолинская, д. 33";"г. Новосибирск, ул. Золотодолинская, д. 33";+79137107744;nsmnam@yandex.ru;http://тсж.жкхнсо.рф/тсж-долина/;1;5035,50;24,50
8927278;"Новосибирская область";"Товарищество собственников жилья ""Дом""";"ТСЖ ""Дом""";"Юрий Васильевич Коротких";5404252820;1055404104392;"г. Новосибирск, ул. Блюхера, д. 61/1";"г. Новосибирск, ул. Блюхера, д. 61/1";3613122;y.kopotkix@mail.ru;;1;11049,40;32,50
8635925;"Новосибирская область";"Товарищество   собственников жилья  ""ДОМ""";"ТСЖ ""ДОМ""";"Татьяна Матвеевна Вознесенская";5406381363;1075400000059;"г. Новосибирск, ул. Коммунистическая, д. 50";"г. Новосибирск, ул. Серебренниковская, д. 4/1";8-913-468-99-90;minal_tsg@ngs.ru;ReformaGKH.Ru;1;13100,70;
8914911;"Новосибирская область";"Товарищество собственников жилья ""Дом 226""";"ТСЖ ""Дом 226""";"Владимир Михайлович Мартынюк";5433171615;1075475008432;"рп. Краснообск, д. 226";"рп. Краснообск, д. 226";"(383) 217 4640";tsg226@yandex.ru;http://tsgdom226.ru/;1;34885,00;31,50
8929424;"Новосибирская область";"Товарищество собственников жилья ""Дом 233""";"ТСЖ ""Дом 233""";"Андрей Владимирович Гребенщиков";5433183314;1105476098420;"рп. Краснообск, тер. Микрорайон 2, д. 233, п. 49";"рп. Краснообск, тер. Микрорайон 2, д. 233, п. 49";238-31-96;tsg233ypr@ngs.ru;тсж-дом233.рф;1;31059,90;25,50
8630233;"Новосибирская область";"Товарищество собственников жилья ""Дом 45/1 по ул. Линейная""";"ТСЖ ""Дом 45/1 по ул. Линейная""";"Аля Васильевна Пилипенко";5402519860;1095402013761;"г. Новосибирск, ул. Линейная, д. 45/1";"г. Новосибирск, ул. Линейная, д. 45/1";+79538572922;dom45-1@mail.ru;http://линейная45-1.рф/;1;10161,58;29,50
8628110;"Новосибирская область";"Товарищество собственников жилья ""Дом-9""";"ТСЖ ""Дом-9""";"Мария Григорьевна Маркова";5404239072;1045401532626;"г. Новосибирск, ул. Волховская, д. 35";"г. Новосибирск, ул. Волховская, д. 35";8-953-809-06-15;tsg_9@mail.ru;;1;3801,00;31,00
8435599;"Новосибирская область";"Товарищество собственников жилья ""Дом №9/1""";"ТСЖ ""Дом №9/1""";"Михаил Михайлович Кольчугин";5407481762;1125476211365;"г. Новосибирск, спуск. Владимировский, д. 9/1";"г. Новосибирск, спуск. Владимировский, д. 9/1";229-32-60;dom9-1@ngs.ru;ReformaGKH.Ru;1;8696,30;27,00
8587619;"Новосибирская область";"Товарищество собственников жилья ""Домашний очаг""";"ТСЖ ""Домашний очаг""";"Иван Васильевич Аболмасов";5404354854;1085404007160;"г. Новосибирск, ул. Забалуева, д. 64";"г. Новосибирск, ул. Забалуева, д. 64";8(383)284-19-52;home-nsk@bk.ru;;2;26382,00;
8917267;"Новосибирская область";"Товарищество собственников жилья ""Домашний очаг""";"ТСЖ ""Домашний очаг""";"Светлана Николаевна Гусаченко";5433171358;1075475008003;"рп. Краснообск, д. 102";"рп. Краснообск, д. 102";"8 /383/ 3088065";tsj_domaschnii_ohsag@mail.ru;http://102.videodom54.ru/;1;9053,70;32,50
8927855;"Новосибирская область";"Товарищество собственников жилья ""Домашний очаг""";"ТСЖ ""Домашний очаг""";"Ирина Валерьевна Носова";5404332201;1075400003755;"г. Новосибирск, ул. Костычева, д. 5а";"г. Новосибирск, ул. Костычева, д. 5а";8(383)217-42-65;irina_v_nosova@mail.ru;;1;7730,30;32,00
8916748;"Новосибирская область";"Товарищество собственников жилья ""Дом для жизни""";"ТСЖ ""Дом для жизни""";"Ольга Арнольдовна Клочихина";5407494257;1145476022922;"г. Новосибирск, ул. Свердлова, д. 7";"г. Новосибирск, ул. Свердлова, д. 7";3832310465;tsj.domdlyjizni@yandex.ru;;1;2569,40;18,00
8637460;"Новосибирская область";"Товарищество собственников жилья ""Доминиум""";"ТСЖ ""Доминиум""";"Галина Викторовна Мантула";5406231819;1025402462425;"г. Новосибирск, ул. Советская, д. 52, к. 2";"г. Новосибирск, ул. Советская, д. 56";217-34-64;jont0359@gmail.com;"Интернет-сайте нет.";1;8703,30;18,50
8919737;"Новосибирская область";"Товарищество собственников жилья ""Дом Метрополис""";"ТСЖ ""Дом Метрополис""";"Рудольф Рудольфович Коглер";5406162410;1035402455098;"г. Новосибирск, ул. Гоголя, д. 36";"г. Новосибирск, ул. Гоголя, д. 36";2243384;rudolf_r.kogler@mail.ru;;1;4705,90;25,50
8643952;"Новосибирская область";"Товарищество собственников жилья Дом на Ватутина";"ТСЖ ""Дом на Ватутина""";"Лидия Ивановна Ачудекова";5404226725;1045401492256;"г. Новосибирск, ул. Ватутина, д. 20/1";"г. Новосибирск, ул. Ватутина, д. 20/1";3-54-86-30;Lida.achudekova@mail.ru;;1;10640,00;
8440719;"Новосибирская область";"Товарищество собственников жилья ""Дом на Жуковского""";"ТСЖ ""Дом на Жуковского""";"Владимир Алексеевич Акилин";5402471810;1065400044643;"г. Новосибирск, ул. Жуковского, д. 108";"г. Новосибирск, ул. Жуковского, д. 108";8-913-903-75-91;tsjdomnajukovskogo@mail.ru;http://731.degkh.ru/tszh_dom_na_zhukovskogo;1;4549,70;
8919905;"Новосибирская область";"Товарищество собственников жилья ""Дом на Каменской""";"ТСЖ ""Дом на Каменской""";"Владимир Михайлович Дорофеев";5406159591;1045402449124;"г. Новосибирск, ул. Абразивная, д. 56/1";"г. Новосибирск, ул. Абразивная, д. 56/1";3832015611;dnk2015611@mail.ru;http://домнакаменской.рф;1;6312,00;28,00
8917103;"Новосибирская область";"Товарищество собственников жилья ""Дом На Красном""";"ТСЖ ""Дом На Красном""";"Михаил Дмитриевич Кузнецов";5406689863;1115476138920;"г. Новосибирск, пр-кт. Красный, д. 51, к. 2";"г. Новосибирск, пр-кт. Красный, д. 51, к. 2";+7-913-897-2200;tsgdnk@yandex.ru;;1;3448,10;33,50
7992251;"Новосибирская область";"Товарищество собственников жилья ""Дом на Линейной""";"ТСЖ ""Дом на Линейной""";"Александр Эдуардович Иголинский";5402161600;1025401005739;"г. Новосибирск, ул. Линейная, д. 51";"г. Новосибирск, ул. Линейная, д. 51";2272160;durif@mail.ru;;1;5925,00;32,50
8501418;"Новосибирская область";"Товарищество собственников жилья ""Дом на Народной""";"ТСЖ «Дом на Народной»";"Елена Анатольевна Плеханова";5410000797;1055410002911;"г. Новосибирск, ул. Народная, д. 81";"г. Новосибирск, ул. Народная, д. 81";287-01-83;narodnaja8-1@mail.ru;;1;7448,60;50,50
8926042;"Новосибирская область";"ТОВАРИЩЕСТВО СОБСТВЕННИКОВ ЖИЛЬЯ ""ДОМ НА ОБИ""";"ТСЖ ""ДОМ НА ОБИ""";"Мирзебег Гусенбегович Агабубаев";5405487663;1135476183402;"г. Новосибирск, ул. Обская 2-я, д. 73, п. 2";"г. Новосибирск, ул. Обская 2-я, д. 73, п. 2";89139130660;ff5727@mail.ru;;1;13231,80;33,50
8441227;"Новосибирская область";"Товарищество собственников жилья ""Дом на Октябрьской""";"ТСЖ ""Дом на Октябрьской""";"Марина Геннадьевна Новикова";5407213650;1025403226980;"г. Новосибирск, ул. Октябрьская, д. 34";"г. Новосибирск, ул. Октябрьская, д. 34";383-218-85-29;tsz34@mail.ru;http://731.degkh.ru/tszh_dom_na_oktyabrskoy/;1;33682,40;
8709005;"Новосибирская область";"Товарищество собственников жилья ""Дом на Орджоникидзе""";"ТСЖ ""Дом на Орджоникидзе""";"Людмила Васильевна Быковская ";5406321163;1055406213939;"г. Новосибирск, ул. Семьи Шамшиных, д. 30";"г. Новосибирск, ул. Семьи Шамшиных, д. 30";(383)2035144;tsg-dnao@mail.ru;DNAO;1;18845,70;27,50
8868053;"Новосибирская область";"Товарищество собственников жилья  ""Дом на Покрышкина""";"ТСЖ  ""Дом на Покрышкина""";"Лидия Семёновна Никитина";5403219965;1085403020592;"г. Новосибирск, ул. Покрышкина, д. 1";"г. Новосибирск, ул. Покрышкина, д. 1";8-903-930-40-70;tsgdom_pokrihkina@mail.ru;;1;30190,18;34,50
8913826;"Новосибирская область";"Товарищество собственников жилья ""Дом на Танковой""";"ТСЖ Дом на Танковой";"Юрий Анатольевич Сыслов";5410020881;1085410005174;"г. Новосибирск, ул. Танковая, д. 11/1";"г. Новосибирск, ул. Танковая, д. 11/1";8-903-901-70-90;dom_na_Tankovoi@mail.ru;731.degkh.ru/tszh_dom_na_tankovoy/;1;2881,20;27,50
8915449;"Новосибирская область";"Товарищество собственников жилья ""Домовладелец""";"ТСЖ ""Домовладелец""";"Наталья Юрьевна Кравченко";5402140744;1025401014825;"г. Новосибирск, ул. Линейная, д. 47/2";"г. Новосибирск, ул. Линейная, д. 47/2";+73832165306;tsgdomovladelez@gmail.com;http://www.reformagkh.ru/mymanager/organization/8915449/;1;7766,00;30,50
8918246;"Новосибирская область";"Товарищество собственников жилья ""Дом Под Часами""";"ТСЖ ""Дом Под Часами""";"Олег Павлович Ревякин";5406704053;1125476040832;"г. Новосибирск, пр-кт. Красный, д. 11";"г. Новосибирск, пр-кт. Красный, д. 11";89139858984;dompodchasami@mail.ru;http://731.degkh.ru/tszh_dom_pod_chasami/;1;6663,80;26,50
8917477;"Новосибирская область";"Товарищество Собственников Жилья ""Достоевского,13""";"ТСЖ ""Достоевского,13""";"Вячеслав Иванович Прасолов";5406411120;1075400004866;"г. Новосибирск, ул. Достоевского, д. 13";"г. Новосибирск, ул. Достоевского, д. 13";8(953)930-34-57;v_prasolov@mail.ru;reformagkh.ru;1;3343,60;34,50
8916803;"Новосибирская область";"Товарищество собственников жилья ""Друг""";"ТСЖ ""Друг""";"Николай Николаевич Шелехов";5403135063;1045401317785;"г. Новосибирск, ул. Петухова, д. 82/3";"г. Новосибирск, ул. Петухова, д. 82/3";2153588;TszDrug@yandex.ru;TszDrug.ru;1;3603,00;30,50
7819622;"Новосибирская область";"Товарищество собственников жилья ""Дружба""";"ТСЖ  ""Дружба""";"Татьяна Михайловна Микичур";5403182472;1065403037017;"г. Новосибирск, ул. Новогодняя, д. 4";"г. Новосибирск, ул. Новогодняя, д. 4";8-906-909-6692;mtm502007@yandex.ru;;1;4119,90;35,50
8585705;"Новосибирская область";"Товарищество собственников жилья ""Дружба народов""";"ТСЖ ""Дружба народов""";"Виктор Григорьевич Сорокин";5402512872;1095402006974;"г. Новосибирск, ул. Линейная, д. 33/1";"г. Новосибирск, ул. Линейная, д. 33/1";(383)246-06-37;tszh.dryhba@yandex.ru;;1;10383,20;33,50
8916285;"Новосибирская область";"Товарищество собственников жилья ""Дружная Семья""";"ТСЖ ""Дружная Семья""";"Сергей Павлович Рубанов";5405376530;1085405017763;"г. Новосибирск, ул. Сакко и Ванцетти, д. 33";"г. Новосибирск, ул. Сакко и Ванцетти, д. 31";"89130121000, 206-34-20";drsemia@mail.ru;http://tsg-ds.nethouse.ru/;4;25539,20;33,50
8481748;"Новосибирская область";"Товарищество собственников жилья ""Дружный""";"ТСЖ ""Дружный""";"Татьяна Александровна Кузьмина";5407467253;1115476090180;"г. Новосибирск, ул. Революции, д. 1";"г. Новосибирск, ул. Революции, д. 1";89137171097;kuzmina2010kta@yandex.ru;;1;2588,00;30,50
8619280;"Новосибирская область";"Товарищество собственников жилья ""Дружный""";"ТСЖ ""Дружный""";"Татьяна Петровна Дандерфер";5404379834;1085404034363;"г. Новосибирск, ул. Широкая, д. 15/1";"г. Новосибирск, ул. Широкая, д. 15/1";"(383) 353-66-54";tsgdruznii@ngs.ru;;1;5270,70;31,00
8891233;"Новосибирская область";"Товарищество собственников жилья ""Дубок""";"ТСЖ ""Дубок""";"Галина Яковлевна Пыхтина";5409228437;1065473074710;"г. Новосибирск, ул. Звездная, д. 4а";"г. Новосибирск, ул. Звездная, д. 4а";8-923-199-58-77;ta-vl@yandex.ru;;1;5306,60;32,00
8916756;"Новосибирская область";"Товарищество собственников жилья  ""Дуси Ковальчук 185/1""";"ТСЖ "" Дуси Ковальчук 185/1""";"Антон Александрович Куприсов";5402571613;1145476003001;"г. Новосибирск, ул. Дуси Ковальчук, д. 185/1";"г. Новосибирск, ул. Дуси Ковальчук, д. 185/1";+7-961-876-1075;185d1@mail.ru;;1;10784,40;31,50
8932904;"Новосибирская область";"Товарищество собственников жилья ""Ельцовское""";"ТСЖ ""Ельцовское""";"Светлана Алексеевна Нуркевич";5402459555;1055402077026;"г. Новосибирск, ул. Ельцовская, д. 6/1";"г. Новосибирск, ул. Ельцовская, д. 6/1";8-913-467-88-35;st52@mail.ru;http://тсж.жкхнсо.рф/тсж-ельцовское/;1;2860,20;30,50
8918184;"Новосибирская область";"Товарищество собственников жилья ""Ермак-1""";"ТСЖ ""Ермак-1""";"Андрей Арнольдович Парамонов";5406299824;1045402550071;"г. Новосибирск, ул. Ермака, д. 3";"г. Новосибирск, ул. Ермака, д. 3";2211974;Ermaka3@ngs.ru;http://731.degkh.ru/;1;8692,20;32,50
8920734;"Новосибирская область";"Товарищество Собственников Жилья ""Есенинская Заимка""";"ТСЖ ""Есенинская Заимка""";"Маргарита Станиславовна Передерина";5401140685;1035400527238;"г. Новосибирск, ул. Есенина, д. 9/1";"г. Новосибирск, ул. Есенина, д. 9/1";83832641804;eseninskaya.zaimka@mail.ru;;1;4858,00;27,50
8891958;"Новосибирская область";"Товарищество собственников жилья  «Есенинское-1»";"ТСЖ  «Есенинское-1»";"Евгений Онисимович Комзюк";5401198043;1025400507648;"г. Новосибирск, ул. Есенина, д. 8/2";"г. Новосибирск, ул. Есенина, д. 8/2";8-923-249-7400;Eseninskoe-1@mail.ru;http://731.degkh.ru/tszh_eseninskoe_1/;2;11978,50;28,50
8645811;"Новосибирская область";"Товарищество собственников жилья ""Ефремовец""";"ТСЖ ""Ефремовец""";"Людмила Владимировна Стефановская";5403208353;1085403006040;"г. Новосибирск, ул. Вертковская, д. 10, к. 2";"г. Новосибирск, ул. Вертковская, д. 10, к. 2";314-22-19;sm.mila.2015@yandex.ru;тсж-ефремовец.рф;1;4682,40;28,50
8931769;"Новосибирская область";"Товарищество собственников жилья ""Ефремовец-2""";"ТСЖ ""Ефремовец-2""";"Валентина Денисовна Евстифеева";5403182779;1065403041406;"г. Новосибирск, ул. Петухова, д. 26";"г. Новосибирск, ул. Петухова, д. 26";344-86-97;;;1;4655,60;31,50
8914475;"Новосибирская область";"Товарищество собственников жилья  ""Ефремовец-4""";"ТСЖ ""Ефремовец-4""";"Валентина Филипповна Ольховская";5403183490;1065403045927;"г. Новосибирск, ул. Зорге, д. 17";"г. Новосибирск, ул. Зорге, д. 17";"(383) 342-01-02";vf.nsk@yandex.ru;731.degkh.ru/tszh_efremovets_4;1;3,00;19,00
