id;subject_rf;name_full;name_short;name_employee;inn;orn;legal_address;actual_address;phone;email;site;count_mkd;area_total;w_summ
8922890;"город Москва";"Общество с ограниченной ответственностью ""Главное управление жилищным фондом""";"ООО ""ГУЖФ""";"Глеб Вадимиович Смирнов";7704307993;1157746180305;"г. Москва, пр-кт. Комсомольский, д. 18, стр. 3";"г. Москва, пр-кт. Комсомольский, д. 18, стр. 3";8-800-200-50-58;info@guzhf.ru;http://www.guzhf.ru/;22;57963,40;35,00
8938247;"город Москва";"Федеральное государственное бюджетное учреждение ""Центральное жилищно-коммунальное управление"" Министерств обороны Российской Федерации";"ФГБУ ""ЦЖКУ"" Минобороны России";"Александр Анатольевич Жданов";7729314745;1027700430889;"г. Москва, ул. Спартаковская, д. 2Б";"г. Москва, ул. Спартаковская, д. 2Б";9263148764;info@zhky.ru;;44;74100,44;42,00
8919644;"город Санкт-Петербург";"Общество с ограниченной ответственностью ""Центр управления эксплуатации""";"ООО ""ЦУЭ""";"Дмитрий Сергеевич Лаврентьев";7814421900;1089848006709;"г. Санкт-Петербург, пр-кт. Коломяжский, д. 36/2, п. 6Н";"г. Санкт-Петербург, пр-кт. Коломяжский, д. 36/2, п. 6Н";"(812) 243-99-70, 8-921-897-3136, 8-913-206-95-10";office@yk-cue.ru;http://yk-cue.ru/;4;48527,50;41,00
8923006;"Новосибирская область";"ОБЩЕСТВО С ОГРАНИЧЕННОЙ  ОТВЕТСТВЕННОСТЬЮ УПРАВЛЯЮЩАЯ КОМПАНИЯ ""СФЕРА""";"OOO УК ""СФЕРА""";"Анжела Сергеевна Пухальская";5401951838;1155476030555;"г. Новосибирск, ул. Римского-Корсакова, д. 4";"г. Новосибирск, ул. Новосибирская, д. 27, п. 149";"8(383)287-60-02 круглосуточно";ooouksfera@mail.ru;http://731.degkh.ru/ooo_uk_sfera/;2;36046,30;32,50
8936587;"Новосибирская область";"Администрация Верх-Тулинского сельсовета Новосибирской области";"Администрация Верх-Тулинского сельсовета Новосибирской области";"Ирина Юрьевна Ена ";5433108109;1035404348671;"г. Новосибирск, ул. Советская, д. 1, к. 0";"г. Новосибирск, ул. Советская, д. 1, к. 0";+7(383)2933-269;v2933149@yandex.ru;adm-verh-tula.ru;1;300,90;20,00
8936453;"Новосибирская область";"Администрация Новопичуговского сельсовета Ордынского района Новосибирской области";"Администрация Новопичуговского сельсовета";"Сергей Анатольевич Игашев";5434100529;1025404498349;"с. Новопичугово, ул. Ленина, д. 24";"с. Новопичугово, ул. Ленина, д. 24";3835943120;amopichugi@mail.ru;;2;1146,20;24,00
8922999;"Новосибирская область";"ТСЖ ""Аникинское""";"Аникинское ТСЖ";"Владимир Викторович Поваров";5403170685;1045401311108;"г. Новосибирск, ул. Аникина, д. 25а";"г. Новосибирск, ул. Аникина, д. 25а";9139591588;anikinskoe@mail.ru;http://anikina25a.3dn.ru/;1;4283,40;29,50
8923110;"Новосибирская область";"Автономная некоммерческая управляющая организация «Альтернатива в ЖКХ»";"АНУО «Альтернатива в ЖКХ»";"Анатолий Алексеевич Кустов";5406747931;1135476088880;"г. Новосибирск, пр-кт. Красный, д. 51/3, п. 41";"г. Новосибирск, пр-кт. Красный, д. 51/3, п. 41";"+7 913 920 2318";office@uprav-tsg.ru;www.uprav-tsg.ru;2;40879,60;32,00
8939358;"Новосибирская область";"АКЦИОНЕРНОЕ ОБЩЕСТВО ""МУНИЦИПАЛЬНАЯ УПРАВЛЯЮЩАЯ КОМПАНИЯ""";"АО ""МУК""";"Раиса Ниазовна Протасова";5406982653;1175476115330;"г. Новосибирск, ул. Татарская, д. 83, п. 6";"г. Новосибирск, ул. Татарская, д. 83, п. 6";8(383)209-04-94;ao.muk.nsk@gmail.com;;2;1686,80;26,00
8592266;"Новосибирская область";"Акционерное Общество ""Птицефабрика имени 50-летия СССР""";"АО ""Птицефабрика имени 50-летия СССР""";"Андрей Альбертович Биль";5425001169;1065464012327;"с. Прокудское";"с. Прокудское, д. 1";"(383-51) 42-222";Secr1.PMNovos@nsk.prodo.ru;www.prodo.ru;7;29107,00;34,00
8938371;"Новосибирская область";"Акционерное общество ""Сибирский Сервисный центр""";"АО ""ССЦ""";"Александр Николаевич Лисов";5406613110;1165476125297;"г. Новосибирск, ул. Максима Горького, д. 87, п. 5";"г. Новосибирск, ул. Эйхе, д. 8";;;;1;591,20;20,00
8927271;"Новосибирская область";"Акционерное общество Управляющая компания ""Перспектива""";"АО УК ""Перспектива""";"Вячеслав Александрович Петраш";5401384875;1145476155945;"г. Новосибирск, ул. Эйхе, д. 8";"г. Новосибирск, ул. Эйхе, д. 8";8-383-307-02-06;info@pers54.ru;http://pers54.ru;147;364792,30;33,00
8922372;"Новосибирская область";"Доволенское муниципальное унитарное предприятие коммунального хозяйства";"Доволенское МУП КХ";"Елена Сергеевна Шмидт";5420102580;1055456013128;"с. Баклуши, ул. Заводская, д. 23";"с. Баклуши, ул. Заводская, д. 23";8923-126-3283;pk588@mail.ru;http://www.adm-dovolnoe.ru/economica_razdel.php?id_blok1_levelpages1=3&razdel=economica;32;25806,80;35,00
8623304;"Новосибирская область";"Жилищно-строительный кооператив №22";"Жилищно-строительный кооператив №22";"Ольга Ивановна Губанова";5445009159;1025404728458;"г. Бердск, ул. Красная Сибирь, д. 118";"г. Бердск, ул. Красная Сибирь, д. 118, п. 124";89139588627;tg_v@rambler.ru;;1;7370,60;28,00
8931245;"Новосибирская область";"Жилищно-строительный кооператив""Учитель"" Ж,С.К. ""Учитель""";"Жилищно-строительный кооператив ""Учитель"" Ж.С.К. ""Учитель""";"Зоя Валерьевна Виноградова";5447105404;1025406824761;"г. Куйбышев, кв-л. 13-й, д. 2";"г. Куйбышев, кв-л. 13-й, д. 2";89139571566;y4utel.kainsk@yandex.ru;;1;2586,80;31,50
8916067;"Новосибирская область";"Жилищный Кооператив ""50 лет Октября""";"ЖК ""50 лет Октября""";"Наталья Анатольевна Максименко";5404136503;1035401491223;"г. Новосибирск, ул. Немировича-Данченко, д. 18/1";"г. Новосибирск, ул. Немировича-Данченко, д. 18/1";89134513199;october_50@mail.ru;;1;2817,30;30,50
8592971;"Новосибирская область";"Жилищный кооператив ""50 лет СССР""";"ЖК ""50 лет СССР""";"Ольга Олеговна Колосова";5410109554;1025403907000;"г. Новосибирск, ул. Новая Заря, д. 25/1";"г. Новосибирск, ул. Новая Заря, д. 25/1";+79133854607;50letsssr@ngs.ru;;1;5128,60;35,00
8920777;"Новосибирская область";"Жилищный кооператив «Алмаз»";"ЖК «Алмаз»";"Юрий Алексеевич Баев";5403119777;1025401317996;"г. Новосибирск, ул. Тульская, д. 90, п. 270";"г. Новосибирск, ул. Тульская, д. 90, п. 270";314-34-73;Zhk.almaz.nsk@mail.ru;https://www.reformagkh.ru/mymanager/organization/8920777/;1;26000,00;30,00
8567007;"Новосибирская область";"Жилищный кооператив ""Березка""";"ЖК ""Березка""";"Тамара Ильинична Овешникова";5401102168;1035400514214;"г. Новосибирск, ул. Индустриальная, д. 7";"г. Новосибирск, ул. Индустриальная, д. 7";279-00-46;esperansa68@rambler.ru;731.degkh.ru/zhk_berezka/;1;4566,00;32,00
8605084;"Новосибирская область";"Жилищный  кооператив  ""Весна""";"Ж К  ""Весна""";"Нелли Васильевна Мазур";5401102175;1035400527513;"г. Новосибирск, ул. Трикотажная, д. 33";"г. Новосибирск, ул. Трикотажная, д. 33";2790403;lesh@ngs.ru;http://dom.nsk.ru/company/1635;1;3297,00;27,00
8613520;"Новосибирская область";"Жилищный кооператив ""Глобус 2001""";"ЖК ""Глобус 2001""";"Людмила Петровна Кузнецова";5406202889;1035402456957;"г. Новосибирск, ул. Октябрьская, д. 81";"г. Новосибирск, ул. Октябрьская, д. 81";83832234592;GLOBUS2001@NGS.RU;;1;10297,00;30,50
8926231;"Новосибирская область";"Жилищный Кооператив ""Гурьевский""";"ЖК ""Гурьевский""";"Марина Витальевна Ушакова";5405188173;1025401909180;"г. Новосибирск, ул. Гурьевская, д. 37";"г. Новосибирск, ул. Гурьевская, д. 37";8-952-920-19-70;marina_ova@inbox.ru;;1;4627,70;32,00
8583512;"Новосибирская область";"Жилищный кооператив домовладельцев ""Взлёт""";"ЖКД Взлёт";"Владимир Алексеевич Южаков";5401131842;1035400515721;"г. Новосибирск, ул. Адриена Лежена, д. 10, к. 1";"г. Новосибирск, ул. Адриена Лежена, д. 10, к. 1";8-913-947-56-02;vzlet67@bk.ru;;1;6875,40;21,50
8656543;"Новосибирская область";"Жилищный кооператив ""Дружба""";"ЖК ""Дружба""";"Сергей Викторович Белобородов";5404118487;1025401490872;"г. Новосибирск, ул. Блюхера, д. 49";"г. Новосибирск, ул. Блюхера, д. 49, п. 9";8-961-221-08-88;drujba-jk@mail.ru;;1;4153,10;28,00
8612812;"Новосибирская область";"Жилищный кооператив «Дружба-4»";"ЖК «Дружба-4»";"Галина Семеновна Василенко";5410109466;1025403906494;"г. Новосибирск, ул. Учительская, д. 17/1";"г. Новосибирск, ул. Учительская, д. 17/1";"+7 383 265-71-07";n.n.59trofimova@yandex.ru;http://тсж.жкхнсо.рф/жк-дружба4/;1;10055,30;32,50
8438131;"Новосибирская область";"Жилищный кооператив ""Железнодорожник""";"ЖК ""Железнодорожник""";"Михаил Васильевич Субботин";5407120244;1025403214693;"г. Новосибирск, ул. Ленина, д. 30/1";"г. Новосибирск, ул. Ленина, д. 30/1";89139274117;mvs_nsk@mail.ru;;1;4332,50;28,50
8627433;"Новосибирская область";"Жилищный кооператив «Звездочка»";"ЖК «Звездочка»";"Людмила Владимировна Бельских";5401108434;1025400532310;"г. Новосибирск, ул. Промышленная, д. 4";"г. Новосибирск, ул. Промышленная, д. 4";279-35-88;svetlana.liha4ewa@mail.ru;http://тсж.жкхнсо.рф/жк-звездочка/;1;2541,10;27,50
8610930;"Новосибирская область";"Жилищный кооператив ""Зорька""";"ЖК ""Зорька""";"Виталий Валентинович Бирюков";5401102055;1025400518659;"г. Новосибирск, ш. Гусинобродский тракт, д. 31";"г. Новосибирск, ш. Гусинобродский тракт, д. 31";89139319158;zorka.1982@mail.ru;;1;4867,50;28,50
8578227;"Новосибирская область";"ЖИЛИЩНЫЙ КООПЕРАТИВ ""ЛУНА""";"ЖК""ЛУНА""";"РАИСА ПЕТРОВНА РАКУТОВА";5401108586;1025400518307;"г. Новосибирск, ул. Адриена Лежена, д. 14";"г. Новосибирск, ул. Адриена Лежена, д. 14, п. 45";89134786449;gskluna@mail.ru;reformagkh.ru;1;3046,40;27,50
8497014;"Новосибирская область";"Жилищный кооператив ""МАЯК""";"ЖК ""МАЯК""";"Александр Васильевич Родин";5407120910;1025403219050;"г. Новосибирск, ул. Челюскинцев, д. 10, п. 9";"г. Новосибирск, ул. Челюскинцев, д. 10, п. 9";291-44-42;rodin-cto@mail.ru;www.ru;1;4340,20;31,00
8927178;"Новосибирская область";"Жилищный кооператив «Металлург-3»";"ЖК «Металлург-3»";"Рената Валерьевна Аникина";5404118470;1035401479960;"г. Новосибирск, ул. Немировича-Данченко, д. 28";"г. Новосибирск, ул. Немировича-Данченко, д. 28";89538055731;anikina-renata@mail.ru;http://тсж.жкхнсо.рф/жк-металлург3/;1;3374,80;30,50
8829572;"Новосибирская область";"Жилищный кооператив ""Мечта""";"ЖК ""Мечта""";"Наталья Николаевна Бородина";5409103237;1025403870733;"г. Новосибирск, ул. Березовая, д. 1";"г. Новосибирск, ул. Березовая, д. 1";+7(383)3073140;gk_mechta@mail.ru;;1;6116,00;28,50
8650760;"Новосибирская область";"Жилищный кооператив ""МИР""";"ЖК ""МИР""";"Дмитрий Михайлович Лизунков";5402103301;1025401027706;"г. Новосибирск, ул. Дачная, д. 25/1, п. 73";"г. Новосибирск, ул. Дачная, д. 25/1, п. 15";"+7 9612286256";ldm.arc@mail.ru;;1;4147,60;28,50
8929290;"Новосибирская область";"Жилищный кооператив ""ПАРУС-1""";"ЖК ""ПАРУС-1""";"Александр Васильевич Митин";5410109787;1025403914106;"г. Новосибирск, ул. Кропоткина, д. 134, п. 201";"г. Новосибирск, ул. Кропоткина, д. 134, п. 201";89231245134;avmi58@mail.ru;;1;33407,20;30,50
8156765;"Новосибирская область";"Жилищный Кооператив ""Планета""";"ЖК ""Планета""";"Андрей Владимирович Прямоносов";5402103358;1025401026562;"г. Новосибирск, ул. Дачная, д. 25/2";"г. Новосибирск, ул. Дачная, д. 25/2";"8 913 380 14 15";planeta25-2@mail.ru;www.планета.жкх-новосибирск.рф;1;3210,04;27,50
8929193;"Новосибирская область";"Жилищный кооператив ""Радуга-2""";"ЖК ""Радуга-2""";"Владимир Викторович Лобекин";5409104093;1025403868786;"г. Новосибирск, ул. Шукшина, д. 7";"г. Новосибирск, ул. Шукшина, д. 7";8-913-382-20-33;shukshina7@inbox.ru;;1;2582,70;29,50
8642608;"Новосибирская область";"Жилищный кооператив ""Роща""";"ЖК ""Роща"" ";"Зинаида Петровна Куликова";5410109434;1025403907022;"г. Новосибирск, ул. Олеко Дундича, д. 25";"г. Новосибирск, ул. Олеко Дундича, д. 25";2041385;zina.kulikova.38@mail.ru;http://жк-роща.рф;1;5809,20;28,50
8915855;"Новосибирская область";"Жилищный кооператив ""Сибсельмашевец-1!";"ЖК ""Сибсельмашевец-1""";"Альбина Николаевна Белина";5404117846;1035401490541;"г. Новосибирск, ул. Немировича-Данченко, д. 14/2";"г. Новосибирск, ул. Немировича-Данченко, д. 14/2";"8 9139599645";kld123@yandex.ru;;1;2913,30;29,00
8913508;"Новосибирская область";"Жилищный кооператив Сибсельмашевец-4";"ЖК Сибсельмашевец-4";"Лидия Александровна Капгер";5404117839;1035401484766;"г. Новосибирск, ул. Ударная, д. 23";"г. Новосибирск, ул. Ударная, д. 23";(383)343-33-13;sibselmash4@gmail.com;;1;1188,98;24,50
8924406;"Новосибирская область";"Жилищный кооператив ""Снежинка""";"ЖК ""Снежинка""";"Сергей Михайлович Петров";5401108515;1025400518637;"г. Новосибирск, ул. Кошурникова, д. 51";"г. Новосибирск, ул. Кошурникова, д. 51";8-903-906-5781;gk-sneginka@mail.ru;;1;8670,00;23,50
8915206;"Новосибирская область";"Жилищный кооператив ""СОСНОВЫЙ БОР""";"ЖК ""Сосновый бор""";"Лариса Михайловна Бокслер";5402103326;1035401008862;"г. Новосибирск, ул. Дачная, д. 21, к. 3";"г. Новосибирск, ул. Дачная, д. 21, к. 3";8-960-794-92-41;boksler@yandex.ru;731.gkh.ru;1;6079,30;59,50
8627444;"Новосибирская область";"Жилищный кооператив «Тайга-2»";"ЖК «Тайга-2»";"Людмила Федоровна Гуменная";5402109208;1025401024747;"г. Новосибирск, ул. Линейная, д. 47";"г. Новосибирск, ул. Линейная, д. 47";236-04-55;Luiza_Privalova@mail.ru;http://тсж.жкхнсо.рф/жк-тайга2/;1;;13,50
8914611;"Новосибирская область";"жилищный кооператив "" Транспортник""";"ЖК ""Транспортник""";"Дина Борисовна Оренбурова Дина Борисовна";5407120886;1035403190668;"г. Новосибирск, ул. Ленина, д. 30/2";"г. Новосибирск, ул. Ленина, д. 30/2";89137404356;dina.orenburova@yandex.ru;deqkh.ru;1;4104,90;33,50
8880531;"Новосибирская область";"Жилищный кооператив ""Ударник""";"ЖК ""Ударник""";"Игорь Александрович Горнаков";5401102016;1035400510771;"г. Новосибирск, ул. Доватора, д. 13";"г. Новосибирск, ул. Доватора, д. 13";8-913-200-72-63;Ekaterina_02041957@mail.ru;;1;7087,10;31,50
8914827;"Новосибирская область";"Жилищно-строительный кооператив ""Южный-1""";"ЖКХ ""Южный-1""";"Василий Александрович Киселев";5408119749;2085473070362;"г. Новосибирск, ул. Печатников, д. 11";"г. Новосибирск, ул. Печатников, д. 11";89529141725;vakiselev82@rambler.ru;http://731.degkh.ru/zhsk_yuzhnyy_1/;1;2700,00;21,00
8922420;"Новосибирская область";"Жилищный кооператив ""Центральный""";"ЖК ""Центральный""";"Марина Вианоровна Кондратьева";5405115778;1025401924668;"г. Новосибирск, ул. Белинского, д. 6";"г. Новосибирск, ул. Белинского, д. 6";(383)218-84-91;bel6@bel6.ru;http://bel6.ru/;1;21052,10;26,50
8918316;"Новосибирская область";"Жилищный кооператив ""Электрон""";"ЖК ""Электрон""";" Андрей Геннадьевич Маркин";5405108756;1025401924514;"г. Новосибирск, ул. Добролюбова, д. 22";"г. Новосибирск, ул. Добролюбова, д. 22";"8 (962) 8383798";;;1;4372,10;22,00
8431458;"Новосибирская область";"Жилищный кооператив ""Южный-3""";"ЖК ""Южный-3""";"Наталья Игоревна Деркачева";5405116482;1025401932093;"г. Новосибирск, ул. Декабристов, д. 111";"г. Новосибирск, ул. Декабристов, д. 111";8(961)875-66-02;dekabristov.111@mail.ru;jkyuznyi.narod2.ru;1;13472,00;
8595040;"Новосибирская область";"Жилищно-строительный кооператив №16";"ЖСК №16";"Владимир Михайлович Горлов";5445008275;1025404731406;"г. Бердск, ул. Лунная, д. 14";"г. Бердск, ул. Лунная, д. 14";3834137072;gsk16@list.ru;лунная14.рф;1;4421,00;28,50
8612838;"Новосибирская область";"ЖИЛИЩНО-СТРОИТЕЛЬНЫЙ КООПЕРАТИВ-17";ЖСК-17;"ВАЛЕНТИНА КИРИЛЛОВНА КОРЖОВА";5445008229;1025404730427;"г. Бердск, ул. Ленина, д. 90";"г. Бердск, ул. Ленина, д. 90";"8(38341)29396 ";korgova55@mail.ru;;2;10578,00;24,00
8924638;"Новосибирская область";"Жилищно-строительный кооператив ""50 лет Октября""";"ЖСК ""50 лет Октября""";"Владимир Афанасьевич Матвеев";5405115619;1025401934975;"г. Новосибирск, ул. Добролюбова, д. 24";"г. Новосибирск, ул. Добролюбова, д. 24";8(383)2060494;natalya_wolf@mail.ru;;1;4940,40;28,00
8876694;"Новосибирская область";"Жилищно-строительный кооператив ""50-лет Советской Армии""";"ЖСК 50 лет Советской армии";"Иосиф Михайлович Лернер";5401108610;1035400513081;"г. Новосибирск, ул. Кошурникова, д. 13";"г. Новосибирск, ул. Кошурникова, д. 13";3832783663;s14031969@mail.ru;www.reformagkh.ru;1;5910,60;
8915929;"Новосибирская область";"ЖИЛИЩНО-СТРОИТЕЛЬНЫЙ КООПЕРАТИВ ""8 МАРТА""";"ЖСК ""8 МАРТА""";"Владимир Анатольевич Балаганский";5402110010;1025401021690;"г. Новосибирск, ул. Переездная, д. 64";"г. Новосибирск, ул. Переездная, д. 64";89618484857;jsk8marta@mail.ru;http://8-mart.i-gkh.ru;1;8381,00;28,50
8928389;"Новосибирская область";"Жилищно-строительный кооператив ""9 Мая""";"ЖСК ""9 Мая""";"Сергей Викторович Ганчин";5405115400;1025401924492;"г. Новосибирск, ул. Никитина, д. 9";"г. Новосибирск, ул. Никитина, д. 9";89529066999;sganchin@yandex.ru;;1;2658,90;24,50
8915373;"Новосибирская область";"Жилищно-строительный кооператив ""Авангард""";"ЖСК ""Авангард""";"Тамара Михайловна Кузьмина";5402103319;1025401024615;"г. Новосибирск, ул. Михаила Перевозчикова, д. 7";"г. Новосибирск, ул. Михаила Перевозчикова, д. 7";2272225;Inkognito94@list.ru;;1;2633,30;
8918723;"Новосибирская область";"Жилищно-строительный кооператив ""Аврора""";"ЖСК ""Аврора""";"Валерий Федорович Голямов";5406014412;1025402488803;"г. Новосибирск, ул. Ипподромская, д. 30";"г. Новосибирск, ул. Ипподромская, д. 30";224-08-19;avroragsk@mail.ru;http://731.degkh.ru/zhsk_avrora/;2;21105,30;
8936818;"Новосибирская область";"Жилищно-строительный кооператив ""Автогенная 69""";"ЖСК ""Автогенная 69""";"Анатолий Владимирович Салаев";5407467285;1115476091037;"г. Новосибирск, ул. Советская, д. 37, п. 410";"г. Новосибирск, ул. Автогенная, д. 69, п. -";8(383)209-08-22;niike@mail.ru;;1;14400,90;31,50
8554658;"Новосибирская область";"Жилищно-строительный кооператив ""Автомобилист""";"ЖСК ""Автомобилист""";"Галина Александровна Шевелева";5447105475;2125485043650;"г. Куйбышев, кв-л. 14-й, д. 1";"г. Куйбышев, кв-л. 14-й, д. 1";5-26-26;sever7777777@mail.ru;;1;2860,90;22,00
